{
  "$schema": "https://json-schema.org/draft/2020-12/schema",
  "$id": "https://devops-course.local/schemas/artifact.schema.json",
  "title": "Artifact",
  "description": "产物记录。约定：Job 只内嵌元数据与小结果，Dockerfile、构建日志等大文件一律以 artifact URI 引用传递，接收方按约定解析或经下载接口取用。",
  "type": "object",
  "required": ["artifact_id", "type", "uri", "media_type", "producer_job_id", "environment_id", "sha256", "size_bytes", "created_at", "source_commit"],
  "additionalProperties": false,
  "properties": {
    "artifact_id": {
      "type": "string",
      "pattern": "^[a-z0-9][a-z0-9-]*$",
      "description": "产物编号，在平台内全局唯一。",
      "examples": ["dockerfile-001", "buildlog-0007"]
    },
    "type": {
      "type": "string",
      "enum": [
        "DOCKERFILE",
        "BUILD_LOG",
        "VERIFY_LOG",
        "IMAGE_REF",
        "ACTUAL_GRAPH",
        "DECLARED_GRAPH",
        "ERROR_REPORT",
        "PATCH"
      ],
      "description": "产物类型。DOCKERFILE / BUILD_LOG / VERIFY_LOG / IMAGE_REF 由环境生成服务产出；ACTUAL_GRAPH / DECLARED_GRAPH / ERROR_REPORT 由依赖检测服务产出；PATCH 由依赖修复服务产出。"
    },
    "uri": {
      "type": "string",
      "pattern": "^artifact://(draft|mdfixer|buildchecker|echecker|oracle)/[^/]+/.+$",
      "description": "产物地址，形如 artifact://<存储域>/<job_id>/<文件名>。存储域按**服务**命名：`draft` / `mdfixer` / `buildchecker` / `echecker`；人工基线样例的产物用 `oracle` 域，以免冒充工具产出。取用一律经 GET /v1/artifacts/{artifact_id}，uri 是给人的原始地址，不承担寻址职责。",
      "examples": ["artifact://draft/job-draft01/Dockerfile", "artifact://oracle/job-oracle-mdfixer01/error-report.json"]
    },
    "media_type": {
      "type": "string",
      "description": "MIME 类型。",
      "examples": ["text/plain", "application/json", "text/x-dockerfile"]
    },
    "producer_job_id": {
      "type": "string",
      "pattern": "^job-[A-Za-z0-9_-]+$",
      "description": "产出该产物的任务编号，用于追溯。"
    },
    "environment_id": {
      "type": ["string", "null"],
      "pattern": "^env-[A-Za-z0-9_-]+$",
      "description": "产物所属环境。DRAFT 产物产生时环境尚未建立，值为 null；其余产物使用全局环境 ID。"
    },
    "sha256": {
      "type": "string",
      "pattern": "^[0-9a-f]{64}$",
      "description": "内容摘要，需要在交接时核验完整性则填。"
    },
    "size_bytes": {
      "type": ["integer", "null"],
      "minimum": 0,
      "description": "内容字节数；不适用时为 null。"
    },
    "created_at": {
      "type": "string",
      "format": "date-time",
      "pattern": "\\.[0-9]{3}Z$",
      "description": "Artifact 可被引用的 UTC 时间，RFC 3339 格式、毫秒精度。"
    },
    "source_commit": {
      "type": "string",
      "pattern": "^[0-9a-f]{40}$",
      "description": "产该产物时仓库所处的 commit SHA。保证产物与源码版本可对应。"
    }
  },
  "allOf": [
    {
      "if": { "properties": { "uri": { "pattern": "^artifact://draft/" } }, "required": ["uri"] },
      "then": { "properties": { "environment_id": { "const": null } } },
      "else": { "properties": { "environment_id": { "type": "string" } } }
    }
  ]
}
