{
  "artifact_id": "dockerfile-001",
  "type": "DOCKERFILE",
  "uri": "artifact://draft/job-draft01/Dockerfile",
  "media_type": "text/x-dockerfile",
  "producer_job_id": "job-draft01",
  "environment_id": null,
  "sha256": "3d25c855c116dc8cd0101b2851586d9895f11f0f978f34fca47ff7d0a1a26bcf",
  "size_bytes": 519,
  "created_at": "2026-09-20T10:03:41.000Z",
  "source_commit": "d47a1523beec3311033eabf2e74c2a6ac299720d"
}
