{
  "artifact_id": "image-ref-002",
  "type": "IMAGE_REF",
  "uri": "artifact://draft/job-draft-mdfixer01/image-ref.txt",
  "media_type": "text/plain",
  "producer_job_id": "job-draft-mdfixer01",
  "environment_id": null,
  "sha256": "a25f03d8afdd91e6ad3e9108dd16e3987edb2829dbb9e49576e0068c3f2542c2",
  "size_bytes": 20,
  "created_at": "2026-09-20T09:00:00.000Z",
  "source_commit": "31cd2ad96ad5660db491b41aa2a396e7f1e092a3"
}
