{
  "artifact_id": "declared-graph-001",
  "type": "DECLARED_GRAPH",
  "uri": "artifact://buildchecker/job-full01/declared-graph.json",
  "media_type": "application/json",
  "producer_job_id": "job-full01",
  "environment_id": "env-draft-fixture-mode0",
  "sha256": "80dc8adc07f7b77b8516105e90d4c4e329af8c8ac326f4befd341968e4e43b44",
  "size_bytes": 705,
  "created_at": "2026-09-23T09:00:00.000Z",
  "source_commit": "d47a1523beec3311033eabf2e74c2a6ac299720d"
}
